[
  {
    "persona_id": "CH-A01",
    "panel": "child_experience",
    "is_anchor": true,
    "anchor_archetype": "impatient_dropout",
    "age": 10,
    "gender": "M",
    "reading_level": "average",
    "weekly_reading_minutes": 30,
    "attention_span": "short",
    "mystery_affinity": 0.55,
    "visual_dependency": 0.75,
    "competitor_familiarity": 0.15,
    "competitor_titles_read": [],
    "strictness": 0.62,
    "low_reading_motivation": true,
    "cultural_familiarity": "jp_native",
    "language_background": "ja",
    "primary_motive": "前三页没有怪事就放下",
    "main_aversion": "连续说明超过两页",
    "human_summary_ja": "10歳・読書は苦手。最初の3ページで事件が始まらないと続けない。",
    "human_summary_zh": "10岁、阅读意愿偏低；前三页没有怪事就会放下。"
  },
  {
    "persona_id": "CH-A02",
    "panel": "child_experience",
    "is_anchor": true,
    "anchor_archetype": "mystery_rereader",
    "age": 12,
    "gender": "F",
    "reading_level": "high",
    "weekly_reading_minutes": 180,
    "attention_span": "long",
    "mystery_affinity": 0.92,
    "visual_dependency": 0.35,
    "competitor_familiarity": 0.85,
    "competitor_titles_read": ["放課後ミステリクラブ"],
    "strictness": 0.78,
    "low_reading_motivation": false,
    "cultural_familiarity": "jp_native",
    "language_background": "ja",
    "primary_motive": "伏線を見つけて推理したい",
    "main_aversion": "手がかりが不公平",
    "human_summary_ja": "12歳・ミステリー好き。伏線をメモしながら読む。",
    "human_summary_zh": "12岁推理迷，会回翻伏笔，对线索公平性很敏感。"
  },
  {
    "persona_id": "CH-A03",
    "panel": "child_experience",
    "is_anchor": true,
    "anchor_archetype": "visual_dependent",
    "age": 11,
    "gender": "F",
    "reading_level": "average",
    "weekly_reading_minutes": 60,
    "attention_span": "medium",
    "mystery_affinity": 0.48,
    "visual_dependency": 0.91,
    "competitor_familiarity": 0.25,
    "competitor_titles_read": [],
    "strictness": 0.40,
    "low_reading_motivation": false,
    "cultural_familiarity": "jp_native",
    "language_background": "ja",
    "primary_motive": "絵で物語がわかるか",
    "main_aversion": "文字だけが長いページ",
    "human_summary_ja": "11歳・イラスト依存が高い。図がないと人物を混同しやすい。",
    "human_summary_zh": "11岁高度依赖插画，文字过长页容易跳读。"
  },
  {
    "persona_id": "CH-A04",
    "panel": "child_experience",
    "is_anchor": true,
    "anchor_archetype": "low_motivation_resistant",
    "age": 11,
    "gender": "M",
    "reading_level": "low",
    "weekly_reading_minutes": 15,
    "attention_span": "short",
    "mystery_affinity": 0.30,
    "visual_dependency": 0.60,
    "competitor_familiarity": 0.05,
    "competitor_titles_read": [],
    "strictness": 0.50,
    "low_reading_motivation": true,
    "cultural_familiarity": "jp_native",
    "language_background": "ja",
    "primary_motive": "ゲームや動画の方が面白い",
    "main_aversion": "漢字が多い長文",
    "human_summary_ja": "11歳・本よりゲーム派。漢字だらけのページで止まる。",
    "human_summary_zh": "11岁低阅读意愿，易被游戏短视频打断，大段文字会放弃。"
  },
  {
    "persona_id": "CH-A05",
    "panel": "child_experience",
    "is_anchor": true,
    "anchor_archetype": "science_curious",
    "age": 11,
    "gender": "F",
    "reading_level": "high",
    "weekly_reading_minutes": 90,
    "attention_span": "medium",
    "mystery_affinity": 0.65,
    "visual_dependency": 0.50,
    "competitor_familiarity": 0.40,
    "competitor_titles_read": ["科学探偵"],
    "strictness": 0.55,
    "low_reading_motivation": false,
    "cultural_familiarity": "jp_native",
    "language_background": "ja",
    "primary_motive": "観察や実験が本当にできるか",
    "main_aversion": "科学が間違っている説明",
    "human_summary_ja": "11歳・理科好き。自分で試せる観察があると続ける。",
    "human_summary_zh": "11岁偏科学好奇，关心观察实验是否可信、能否自己做。"
  },
  {
    "persona_id": "CH-A06",
    "panel": "child_experience",
    "is_anchor": true,
    "anchor_archetype": "friendship_focus",
    "age": 10,
    "gender": "F",
    "reading_level": "average",
    "weekly_reading_minutes": 75,
    "attention_span": "medium",
    "mystery_affinity": 0.42,
    "visual_dependency": 0.55,
    "competitor_familiarity": 0.20,
    "competitor_titles_read": [],
    "strictness": 0.35,
    "low_reading_motivation": false,
    "cultural_familiarity": "jp_native",
    "language_background": "ja",
    "primary_motive": "友達関係がリアルか",
    "main_aversion": "キャラが機能だけ",
    "human_summary_ja": "10歳・友情とキャラの温度を見る。",
    "human_summary_zh": "10岁重人物友情，讨厌工具人角色。"
  },
  {
    "persona_id": "CH-A07",
    "panel": "child_experience",
    "is_anchor": true,
    "anchor_archetype": "competitor_experienced",
    "age": 12,
    "gender": "M",
    "reading_level": "high",
    "weekly_reading_minutes": 120,
    "attention_span": "long",
    "mystery_affinity": 0.88,
    "visual_dependency": 0.45,
    "competitor_familiarity": 0.90,
    "competitor_titles_read": ["放課後ミステリクラブ", "エンサイクロペディア・ブラウン"],
    "strictness": 0.70,
    "low_reading_motivation": false,
    "cultural_familiarity": "jp_native",
    "language_background": "ja",
    "primary_motive": "他のミステリーと比べて新しいか",
    "main_aversion": "定番トリックの焼き直し",
    "human_summary_ja": "12歳・競合作品経験あり。差別化と新鮮さを見る。",
    "human_summary_zh": "12岁读过同类竞品，关注差异化和套路感。"
  },
  {
    "persona_id": "AD-A01",
    "panel": "adult_gate",
    "is_anchor": true,
    "anchor_archetype": "safety_sensitive_parent",
    "age": 38,
    "gender": "F",
    "role": "parent_caregiver",
    "reading_level": "n/a",
    "strictness": 0.75,
    "risk_sensitivity": 0.90,
    "purchase_sensitivity": 0.55,
    "cultural_familiarity": "jp_native",
    "language_background": "ja",
    "primary_motive": "怖くない・犯罪っぽくない",
    "main_aversion": "暗い結末やいじめ描写の過剰",
    "human_summary_ja": "38歳・保護者。安全と年齢適合を最優先。",
    "human_summary_zh": "38岁家长，安全与适龄是第一判断。"
  },
  {
    "persona_id": "AD-A02",
    "panel": "adult_gate",
    "is_anchor": true,
    "anchor_archetype": "value_buying_parent",
    "age": 41,
    "gender": "M",
    "role": "parent_caregiver",
    "reading_level": "n/a",
    "strictness": 0.50,
    "risk_sensitivity": 0.60,
    "purchase_sensitivity": 0.85,
    "cultural_familiarity": "jp_native",
    "language_background": "ja",
    "primary_motive": "参考書ではなく読書力になるか",
    "main_aversion": "説教やテスト問題みたいな構成",
    "human_summary_ja": "41歳・購入判断重視。参考書感が強いと買わない。",
    "human_summary_zh": "41岁家长，关注购买理由是否清晰、是否像教辅。"
  },
  {
    "persona_id": "AD-A03",
    "panel": "adult_gate",
    "is_anchor": true,
    "anchor_archetype": "school_librarian",
    "age": 45,
    "gender": "F",
    "role": "librarian_promoter",
    "reading_level": "n/a",
    "strictness": 0.65,
    "risk_sensitivity": 0.70,
    "purchase_sensitivity": 0.40,
    "cultural_familiarity": "jp_native",
    "language_background": "ja",
    "primary_motive": "貸出・読書会で勧められるか",
    "main_aversion": "語彙難易度がクラス平均を大きく超える",
    "human_summary_ja": "45歳・図書委員/司書視点。推薦と語彙難度を見る。",
    "human_summary_zh": "45岁图书馆员视角，看推荐价值与语言难度。"
  },
  {
    "persona_id": "PR-A01",
    "panel": "pro_diagnosis",
    "is_anchor": true,
    "anchor_archetype": "children_editor",
    "age": 42,
    "gender": "F",
    "role": "children_editor",
    "reading_level": "n/a",
    "strictness": 0.80,
    "cultural_familiarity": "jp_native",
    "language_background": "ja",
    "primary_motive": "首章フックとシリーズ継続設計",
    "main_aversion": "1話完結感が強すぎて次が読めない",
    "human_summary_ja": "児童文学編集視点。シリーズ化と冒頭フック。",
    "human_summary_zh": "童书编辑视角，关注首章钩子与系列潜力。"
  },
  {
    "persona_id": "PR-A02",
    "panel": "pro_diagnosis",
    "is_anchor": true,
    "anchor_archetype": "jp_campus_reviewer",
    "age": 39,
    "gender": "M",
    "role": "jp_campus_reviewer",
    "reading_level": "n/a",
    "strictness": 0.72,
    "cultural_familiarity": "jp_native",
    "language_background": "ja",
    "primary_motive": "名古屋の学校生活のリアリティ",
    "main_aversion": "日本の学校制度の誤り",
    "human_summary_ja": "日本校园文化校审视角（名古屋）。制度・用語の正確さ。",
    "human_summary_zh": "日本校园文化审校（名古屋），关注制度与用语准确性。"
  }
]
